{"schemaVersion":"1.0","sessionId":"budget-session","taskContractId":"budget-task","ledgerTraceId":"budget-trace","generatedAt":"1970-01-01T00:00:00.0000000Z","sourceDigest":"572084a9b0b6acbfd1c05438878621547d5617daf02add6d4723e9d2e8daf423","obligations":[{"obligationId":"o1","ledgerStatus":"satisfied","observedInvocationCount":2,"observedElapsedMillis":1999,"observedTokensTotal":150},{"obligationId":"o2","ledgerStatus":"satisfied","observedInvocationCount":1,"observedElapsedMillis":999,"observedTokensTotal":100}]}
