{"schemaVersion":"1.0","sessionId":"budget-session","taskContractId":"budget-task","ledgerTraceId":"budget-trace","generatedAt":"1970-01-01T00:00:00.0000000Z","sourceDigest":"0c4812b213eddb89029d117cdfc864ecd150614fe866749b1fdd76d1f2d04055","obligations":[{"obligationId":"o1","ledgerStatus":"satisfied","observedInvocationCount":2,"observedElapsedMillis":1999,"observedTokensTotal":null},{"obligationId":"o2","ledgerStatus":"satisfied","observedInvocationCount":1,"observedElapsedMillis":999,"observedTokensTotal":100}]}
